[
  {
    "id": "VEND-SMK-001",
    "module": "vendor-management",
    "category": "smoke",
    "subFeature": "Vendor Registry",
    "title": "Vendor registry (/vendors/list) loads without error for a fresh organization",
    "priority": "P0",
    "type": "both",
    "automationStatus": "not_automated",
    "preconditions": ["Logged in as org admin of a newly created (zero-vendor) org"],
    "steps": [
      "Navigate to /vendors/list"
    ],
    "expectedResult": "Page loads with a correct empty state (no vendors) and no console errors, stats cards render as zero rather than crashing or showing stale mock data.",
    "tags": ["smoke", "vendor-registry"],
    "owner": "QA",
    "status": "active",
    "createdAt": "2026-07-31",
    "updatedAt": "2026-07-31"
  },
  {
    "id": "VEND-SMK-002",
    "module": "vendor-management",
    "category": "smoke",
    "subFeature": "Vendor Registry",
    "title": "Creating a vendor via the VendorFormWizard succeeds and appears in the registry",
    "priority": "P0",
    "type": "both",
    "automationStatus": "not_automated",
    "steps": [
      "Open /vendors/list and click 'Add Vendor'",
      "Complete the VendorFormWizard with minimal required fields (name, category, riskTier)",
      "Submit"
    ],
    "expectedResult": "A 201 response is returned, the wizard closes, and the new vendor appears in the registry table with status 'active' without a manual page refresh.",
    "tags": ["smoke", "vendor-registry"],
    "owner": "QA",
    "status": "active",
    "createdAt": "2026-07-31",
    "updatedAt": "2026-07-31"
  },
  {
    "id": "VEND-SMK-003",
    "module": "vendor-management",
    "category": "smoke",
    "subFeature": "Trust Score Computation",
    "title": "Trust score widget renders the default bootstrap value (50 / medium) for a newly created vendor",
    "description": "TrustScoreService.getByVendor bootstraps a default trust score doc (overallScore:50, riskLevel: medium, trend: stable) the first time a vendor is queried with no existing record.",
    "priority": "P1",
    "type": "both",
    "automationStatus": "not_automated",
    "steps": [
      "Open the detail page for a vendor created in the last test with no assessments/evidence yet",
      "Locate the Trust Score card"
    ],
    "expectedResult": "The card renders overall score 50 and risk level 'Medium' without an error state, confirming the default bootstrap path works end-to-end through the UI.",
    "tags": ["smoke", "trust-score"],
    "owner": "QA",
    "status": "active",
    "createdAt": "2026-07-31",
    "updatedAt": "2026-07-31"
  },
  {
    "id": "VEND-SMK-004",
    "module": "vendor-management",
    "category": "smoke",
    "subFeature": "Vendor Portal Security",
    "title": "A freshly generated vendor portal magic link resolves and renders the assessment page",
    "priority": "P0",
    "type": "both",
    "automationStatus": "not_automated",
    "preconditions": ["An assessment has just had sendLink called, producing a valid, unexpired token"],
    "steps": [
      "Open the generated magic link in a fresh (unauthenticated) browser session"
    ],
    "expectedResult": "The vendor portal loads the assessment title and, if no passcode is required, the question list — no Keycloak login prompt appears since the token itself is the auth mechanism.",
    "tags": ["smoke", "vendor-portal"],
    "owner": "QA",
    "status": "active",
    "createdAt": "2026-07-31",
    "updatedAt": "2026-07-31"
  },
  {
    "id": "VEND-SMK-005",
    "module": "vendor-management",
    "category": "smoke",
    "subFeature": "Evidence Lifecycle",
    "title": "Manual evidence upload (Mode 1) succeeds for a whitelisted PDF under the size limit",
    "priority": "P0",
    "type": "both",
    "automationStatus": "not_automated",
    "steps": [
      "Navigate to a vendor's evidence tab and upload a 2 MB PDF via the standard (non-presigned) upload form",
      "Submit with required metadata (title, category, evidenceType)"
    ],
    "expectedResult": "Upload returns 201, the evidence document appears with status 'draft', version 1, and one file in files[] with a computed SHA-256 checksum — no error toast is shown.",
    "tags": ["smoke", "evidence-lifecycle", "s3-upload"],
    "owner": "QA",
    "status": "active",
    "createdAt": "2026-07-31",
    "updatedAt": "2026-07-31"
  },
  {
    "id": "VEND-SMK-006",
    "module": "vendor-management",
    "category": "smoke",
    "subFeature": "Questionnaire Governance",
    "title": "Questionnaire template builder loads and lists at least the system default templates",
    "priority": "P1",
    "type": "both",
    "automationStatus": "not_automated",
    "steps": [
      "Navigate to /vendors/templates",
      "Open the template builder for a new template"
    ],
    "expectedResult": "The templates list and builder UI load without error; creating a minimal draft template (1 domain, 1 question) and saving succeeds.",
    "tags": ["smoke", "questionnaire-governance"],
    "owner": "QA",
    "status": "active",
    "createdAt": "2026-07-31",
    "updatedAt": "2026-07-31"
  }
]
