[
  {
    "id": "SECV-SAN-001",
    "module": "security-vulnerability",
    "category": "sanity",
    "subFeature": "Security Headers Baseline",
    "title": "Backend API responses include Helmet's default security headers",
    "description": "vibrantix-backend/src/index.js calls app.use(helmet()) with no custom config — sanity-checks that Helmet's default header set (e.g. X-Frame-Options: SAMEORIGIN, Strict-Transport-Security, X-Content-Type-Options: nosniff) is actually present on a live response, since defaults alone do not include a custom CSP tuned to this app.",
    "priority": "P2",
    "type": "automated",
    "automationStatus": "not_automated",
    "preconditions": [],
    "steps": [
      "Send GET to any public vibrantix-backend health/API endpoint",
      "Inspect response headers for X-Frame-Options, X-Content-Type-Options, Strict-Transport-Security"
    ],
    "expectedResult": "Helmet's default headers are present. Note: Helmet's default config does not add a custom Content-Security-Policy directive set tuned to this app — treat this as a baseline-only pass, not equivalent to a hardened CSP.",
    "tags": ["security-headers", "smoke-check"],
    "owner": "QA",
    "status": "active",
    "createdAt": "2026-07-31",
    "updatedAt": "2026-07-31"
  },
  {
    "id": "SECV-SAN-002",
    "module": "security-vulnerability",
    "category": "sanity",
    "subFeature": "Injection Middleware Presence",
    "title": "detectInjection middleware fires on a basic SQLi-shaped payload without crashing the request",
    "priority": "P2",
    "type": "automated",
    "automationStatus": "not_automated",
    "preconditions": [],
    "steps": [
      "Send a request with a query string containing ' OR '1'='1",
      "Confirm the request completes with its normal response (not a 500)",
      "Confirm a threat.injection_attempt log entry was emitted"
    ],
    "expectedResult": "Request completes normally and a warning log entry is produced — confirms the detection path is wired up platform-wide, distinct from confirming it blocks anything (it doesn't; see SECV-SEC-001).",
    "tags": ["injection", "smoke-check"],
    "owner": "QA",
    "status": "active",
    "createdAt": "2026-07-31",
    "updatedAt": "2026-07-31"
  },
  {
    "id": "SECV-SAN-003",
    "module": "security-vulnerability",
    "category": "sanity",
    "subFeature": "Secrets Exposure Baseline",
    "title": ".env / .env.* files are not served as static assets by any client-panel or backend route",
    "priority": "P1",
    "type": "automated",
    "automationStatus": "not_automated",
    "preconditions": [],
    "steps": [
      "Request /.env, /.env.local, and /.env.development directly from a running vibrantix-client-panel instance",
      "Repeat against a running vibrantix-backend instance"
    ],
    "expectedResult": "All requests return 404 — no environment file is ever served as a static asset, regardless of the hardcoded-secret findings (SEC-004, SEC-009, SEC-012, SEC-016, SEC-018, SEC-023) which are a source-tree exposure risk, not a runtime-serving risk.",
    "tags": ["secrets-exposure", "smoke-check"],
    "owner": "QA",
    "status": "active",
    "createdAt": "2026-07-31",
    "updatedAt": "2026-07-31"
  },
  {
    "id": "SECV-SAN-004",
    "module": "security-vulnerability",
    "category": "sanity",
    "subFeature": "Unauthenticated Log Endpoint",
    "title": "/api/log accepts a POST with no rate-limit or size cap currently enforced",
    "priority": "P2",
    "type": "manual",
    "automationStatus": "not_automated",
    "linkedDefect": "SEC-047",
    "preconditions": [],
    "steps": [
      "POST a small payload to /api/log twice in quick succession",
      "POST an oversized data/msg field (e.g. a 1MB string) to /api/log"
    ],
    "expectedResult": "Baseline sanity only: confirms current behavior (both requests succeed, no rate limit or size cap observed) matching SEC-047 — this case exists to catch the day a partial fix silently changes the accept-everything behavior without a full regression suite run.",
    "tags": ["logging", "smoke-check"],
    "owner": "QA",
    "status": "active",
    "createdAt": "2026-07-31",
    "updatedAt": "2026-07-31"
  },
  {
    "id": "SECV-SAN-005",
    "module": "security-vulnerability",
    "category": "sanity",
    "subFeature": "Upload MIME Allowlist Baseline",
    "title": "Evidence upload rejects an obviously disallowed MIME type (application/octet-stream) at the fileFilter stage",
    "priority": "P2",
    "type": "automated",
    "automationStatus": "not_automated",
    "preconditions": [
      "Logged in with evidence.write permission"
    ],
    "steps": [
      "Attempt to upload a file declaring Content-Type: application/octet-stream to POST /evidence/upload"
    ],
    "expectedResult": "Request is rejected with 400 \"File type 'application/octet-stream' is not allowed\" at the multer fileFilter stage, per evidence-upload.multer.js's ALLOWED_MIME_TYPES list (octet-stream intentionally excluded) — confirms the baseline allowlist is still wired up before deeper checks like SECV-SEC-002 are evaluated.",
    "tags": ["file-upload", "smoke-check"],
    "owner": "QA",
    "status": "active",
    "createdAt": "2026-07-31",
    "updatedAt": "2026-07-31"
  }
]
